id,pmid,pmcid,journal_abbr,journal_full,year,title,source_used,n_passages,auto_code,norm_tests,stat_context,norm_sentence
33561276,33561276,PMC8152901,Phys Ther,Physical Therapy,2021,Does Falls Efficacy Influence the Relationship Between Forward and Backward Walking Speed After Stroke?,full_text_pdf,3,MIXED,Shapiro-Wilk; Kolmogorov-Smirnov,regression; correlation,
37805994,37805994,PMC10802992,Phys Ther,Physical Therapy,2024,"Effects of Perturbation-Based Treadmill Training on Balance Performance, Daily Life Gait, and Falls in Older Adults: REACT Randomized Controlled Trial.",full_text,5,INCORRECT,Shapiro-Wilk,t-test; ANOVA; Mann-Whitney/Wilcoxon,"First, we checked for normality of data using the Shapiro–Wilk test."
37581587,37581587,PMC11009693,Phys Ther,Physical Therapy,2023,Factors Associated With Long-Term Quadriceps Muscle Function After Surgical Fixation of Lower Extremity Fractures.,full_text_pdf,1,INCORRECT,Kolmogorov-Smirnov,Mann-Whitney/Wilcoxon,
37870503,37870503,PMC10824628,Phys Ther,Physical Therapy,2024,Neuromuscular Electrical Stimulation-Enhanced Physical Therapist Intervention for Functional Posterior Shoulder Instability (Type B1): A Multicenter Randomized Controlled Trial.,full_text,1,INCORRECT,Shapiro-Wilk,t-test,Data were exported from REDCap into Stata software for statistical analyses.Baseline characteristics were compared between the treatment groups by means of descriptive statistics and compared using standardized differences—calculated to 3 decimal places as the mean group difference divided by the co
37847662,37847662,PMC10641927,Phys Ther,Physical Therapy,2023,Validity and Responsiveness of the Portable Warrior Test of Tactical Agility After Rehabilitation in Service Members With Mild Traumatic Brain Injury.,full_text_pdf,1,INCORRECT,Kolmogorov-Smirnov,t-test,
32949237,32949237,PMC7530573,Phys Ther,Physical Therapy,2020,The Development of a Crosswalk for Functional Measures in Postacute Medicare Claims.,full_text_pdf,4,INCORRECT,Kolmogorov-Smirnov,t-test; correlation,
34555167,34555167,PMC8459885,Phys Ther,Physical Therapy,2021,"Associations Between Movement Impairments and Function, Treatment Recommendations, and Treatment Plans for People With Femoroacetabular Impingement Syndrome.",full_text_pdf,4,INCORRECT,Shapiro-Wilk,correlation,
35230421,35230421,PMC9156011,Phys Ther,Physical Therapy,2022,The Neck Disability Index Reflects Allodynia and Headache Disability but Not Cervical Musculoskeletal Dysfunction in Migraine.,full_text,2,MIXED,Shapiro-Wilk,regression,"Participants who had migraine and were grouped into the same cluster as individuals with idiopathic neck pain were considered to have cervical dysfunction, whereas those who were grouped into the same cluster as healthy controls were considered to have no cervical dysfunction.Data AnalysesData were "
37384640,37384640,PMC10309805,Phys Ther,Physical Therapy,2023,Localized Pain and Fatigue During Recovery From Submaximal Resistance Exercise in People With Fibromyalgia.,full_text_pdf,1,INCORRECT,Shapiro-Wilk,,
37140476,37140476,PMC10158643,Phys Ther,Physical Therapy,2023,Measurement Properties of the Patient-Specific Functional Scale in Rehabilitation for Patients With Stroke: A Prospective Observational Study.,full_text,2,INCORRECT,Shapiro-Wilk,,"Further, we did not expect the single-item instruments (ie, mRS, 4MWT, and FAC) to capture change to the same extent as the PSFS.44 Table 2 describes the hypotheses.Data AnalysisWe tested normality with Q-Q plots, Shapiro–Wilk tests, and visual inspection for all groups and subgroups and analyzed th"
37104625,37104625,PMC10071583,Phys Ther,Physical Therapy,2023,Children With Cerebral Palsy Show Higher Static-But Not Higher Dynamic-Motor Fatigability in Grip and Pinch Tasks Than Children With Typical Development Do.,full_text,2,INCORRECT,Shapiro-Wilk,t-test,"Furthermore, for DMF trials, individual peaks in the dynamic measurement were defined by a drop of force between putative peaks of at least 50% of the foregoing peak.Normality of the data was investigated both statistically (using the Shapiro–Wilk test, skewness, and kurtosis) and visually (using hi"
33710269,33710269,PMC8248042,Phys Ther,Physical Therapy,2021,Smartphone Inclinometry Is a Valid and Reliable Tool for Measuring Frontal Plane Tibial Alignment in Healthy and Osteoarthritic Knees.,full_text_pdf,4,MIXED,Shapiro-Wilk,correlation,
35670001,35670001,PMC9396452,Phys Ther,Physical Therapy,2022,Gains in Daily Stepping Activity in People With Chronic Stroke After High-Intensity Gait Training in Variable Contexts.,full_text_pdf,1,INCORRECT,Kolmogorov-Smirnov,Mann-Whitney/Wilcoxon,
37172125,37172125,PMC10071585,Phys Ther,Physical Therapy,2023,Efficacy of Telehealth for Movement-Evoked Pain in People With Chronic Achilles Tendinopathy: A Noninferiority Analysis.,full_text_pdf,2,INCORRECT,Kolmogorov-Smirnov,ANOVA; Mann-Whitney/Wilcoxon,
36200394,36200394,PMC9619742,Phys Ther,Physical Therapy,2022,Participation Among Community-Dwelling Older Adults During the COVID-19 Pandemic: A Cross-Sectional Analysis.,full_text_pdf,1,INCORRECT,Shapiro-Wilk,,
35233607,35233607,PMC8903454,Phys Ther,Physical Therapy,2022,Intensive Care Unit-Acquired Weakness in Patients With COVID-19: Occurrence and Associated Factors.,full_text_pdf,1,INCORRECT,Kolmogorov-Smirnov,,
32915985,32915985,PMC7720640,Phys Ther,Physical Therapy,2020,"The Effectiveness of Hospital in Motion, a Multidimensional Implementation Project to Improve Patients' Movement Behavior During Hospitalization.",full_text,1,INCORRECT,Kolmogorov-Smirnov,t-test; Mann-Whitney/Wilcoxon,Data on these outcomes were retrospectively retrieved from the electronic patient files by data managers and a trained independent research assistant of the patients who were included for the observations.Sample Size and Data AnalysesThe calculation of the required sample size was based on a statist
33735374,33735374,PMC7989156,Phys Ther,Physical Therapy,2021,Cardiopulmonary Exercise Testing to Assess Persistent Symptoms at 6 Months in People With COVID-19 Who Survived Hospitalization: A Pilot Study.,full_text_pdf,2,INCORRECT,Kolmogorov-Smirnov,correlation,
34174073,34174073,PMC8494014,Phys Ther,Physical Therapy,2021,Interexaminer Agreement and Reliability of an Internationally Endorsed Screening Framework for Cervical Vascular Risks Following Manual Therapy and Exercise: The Go4Safe Project.,full_text,2,INCORRECT,Shapiro-Wilk,,"Data were checked for normality using visual inspection of a histogram, a boxplot, and tested with the Shapiro-Wilk test."
28444350,28444350,PMC6257032,Phys Ther,Physical Therapy,2017,"Reliability, Validity, and Minimal Detectable Change of Four-Step Stair Climb Power Test in Community-Dwelling Older Adults.",full_text_pdf,1,INCORRECT,Shapiro-Wilk; Kolmogorov-Smirnov,correlation,
34554253,34554253,PMC8860189,Phys Ther,Physical Therapy,2022,Fear of Reinjury Following Anterior Cruciate Ligament Reconstruction Is Manifested in Muscle Activation Patterns of Single-Leg Side-Hop Landings.,full_text,1,INCORRECT,Shapiro-Wilk,,Biomechanical outcomes and anthropometric group characteristics were normally distributed (Shapiro-Wilk test and histogram inspection).
33735386,33735386,PMC8280925,Phys Ther,Physical Therapy,2021,Heel Rise and Non-Weight-Bearing Ankle Plantar Flexion Tasks to Assess Foot and Ankle Function in People With Diabetes Mellitus and Peripheral Neuropathy.,full_text_pdf,1,INCORRECT,Shapiro-Wilk,t-test,
32671398,32671398,PMC7530576,Phys Ther,Physical Therapy,2020,6-Minute Push Test in Youth Who Have Spina Bifida and Who Self-Propel a Wheelchair: Reliability and Physiologic Response.,full_text,2,MIXED,Shapiro-Wilk,,"First, data were checked for normality using histograms, Q-Q plots, and Shapiro-Wilk tests."
31197369,31197369,PMC6735838,Phys Ther,Physical Therapy,2019,Dose-Response Relationship Between Neuromuscular Electrical Stimulation and Muscle Function in People With Rheumatoid Arthritis.,full_text_pdf,1,INCORRECT,Shapiro-Wilk,,
31220327,31220327,PMC7207355,Phys Ther,Physical Therapy,2019,People With Aneurysmal Subarachnoid Hemorrhage Have Low Physical Fitness and Can Be Predisposed to Inactive and Sedentary Lifestyles.,full_text,1,INCORRECT,Shapiro-Wilk,,Parametric tests were used because the Shapiro-Wilk test showed that fitness data were normally distributed: \documentclass[12pt]{minimal} \usepackage{amsmath} \usepackage{wasysym} \usepackage{amsfonts} \usepackage{amssymb} \usepackage{amsbsy} \usepackage{upgreek} \usepackage{mathrsfs} \setlength{\o
30476281,30476281,PMC12427587,Phys Ther,Physical Therapy,2019,Cardiopulmonary Responses During Clinical and Laboratory Gait Assessments in People With Chronic Stroke.,full_text_pdf,1,INCORRECT,Kolmogorov-Smirnov,,
30690522,30690522,PMC6383712,Phys Ther,Physical Therapy,2019,Muscle Activity During Aquatic and Land Exercises in People With and Without Low Back Pain.,full_text,1,INCORRECT,Shapiro-Wilk,ANOVA,"Polar Monitor, Kempele, Finland), and, for the CLBP group, pain (visual analog scale, scored from 0 to 10) were also recorded.Statistical AnalysisData normality and homogeneity of variance were checked through Shapiro-Wilk and Levene tests (α = .05)."
29088390,29088390,PMC5819851,Phys Ther,Physical Therapy,2018,"Quantitative Evaluation of Muscle Function, Gait, and Postural Control in People Experiencing Critical Illness After Discharge From the Intensive Care Unit.",full_text_pdf,2,INCORRECT,,,
25573759,25573759,PMC4498143,Phys Ther,Physical Therapy,2015,Design and Kinematic Evaluation of a Novel Joint-Specific Play Controller: Application for Wrist and Forearm Therapy.,full_text_pdf,1,INCORRECT,Shapiro-Wilk,correlation,
27103222,27103222,PMC5046191,Phys Ther,Physical Therapy,2016,High-Intensity Interval Training and Moderate-Intensity Continuous Training in Ambulatory Chronic Stroke: Feasibility Study.,full_text_pdf,1,INCORRECT,Shapiro-Wilk,t-test,
33678116,33678116,,Physiother Theory Pract,Physiotherapy Theory and Practice,2022,"Functional Tests As Predictors Of Balance, Fear, And Risk Of Falling In Healthy Subjects.",abstract_only,0,INCORRECT,Shapiro-Wilk,regression; correlation,The Shapiro Wilk test investigated the distribution of the data.
36567617,36567617,PMC10290726,Physiother Theory Pract,Physiotherapy Theory and Practice,2024,Financial impact associated with implementation of the low back pain clinical practice guideline in outpatient physical therapist practice at a large academic medical center.,full_text,2,INCORRECT,Shapiro-Wilk,t-test,Shapiro-Wilk tests for normality were performed prior to analyses on direct PT and medical costs.
32400274,32400274,,Physiother Theory Pract,Physiotherapy Theory and Practice,2022,Blood flow restriction resistance training in a recreationally active person with Parkinson's disease.,abstract_only,0,UNCLEAR,,,
29952694,29952694,PMC6310658,Physiother Theory Pract,Physiotherapy Theory and Practice,2020,"Balance-confidence is associated with community participation, perceived physical mobility, and performance-based function among individuals with a unilateral amputation.",full_text,1,CORRECT,Kolmogorov-Smirnov,regression,"Normality of residuals was tested using the Kolmogorov-Smirnov test (p>.050), linearity and homoscedasticity were evaluated through residual plots, and multicollinearity through examining variation inflation factors, condition indices, and tolerances."
26863987,26863987,PMC4919999,Physiother Theory Pract,Physiotherapy Theory and Practice,2016,Urinary incontinence symptoms and impact on quality of life in patients seeking outpatient physical therapy services.,full_text,1,INCORRECT,Shapiro-Wilk,ANOVA; correlation,Shapiro-Wilk tests were used to assess normality of data and non-parametric analyses were used when data was not normally distributed.
29963931,29963931,PMC6314906,Physiother Theory Pract,Physiotherapy Theory and Practice,2020,Three dimensional kinematics of visually classified lower extremity movement patterns during a single leg squat among people with chronic hip joint pain.,full_text,1,INCORRECT,Shapiro-Wilk,t-test; Mann-Whitney/Wilcoxon,"The Shapiro-Wilk test was used to confirm normal distribution of data, and Levene’s test was used to confirm equality of variance."
29368984,29368984,PMC6320670,Physiother Theory Pract,Physiotherapy Theory and Practice,2018,The reliability and validity of a designed setup for the assessment of static back extensor force and endurance in older women with and without hyperkyphosis.,full_text,1,ACCEPTABLE,Shapiro-Wilk,,The mean force and endurance of each session were compared between older women with and without hyperkyphosis posture.Statistical AnalysisNormality of distribution for all variables was determined using the Shapiro Wilk test in both groups (P > 0.05).
36688719,36688719,PMC10062422,J Orthop Sports Phys Ther,Journal of Orthopaedic & Sports Physical Therapy,2023,Differences in Recovery of Tendon Health Explained by Midportion Achilles Tendinopathy Subgroups: A 6-Month Follow-up.,full_text,1,CORRECT,Shapiro-Wilk,correlation,Residuals were tested using Shapiro-Wilk tests to test the assumption of normality and detect outliers.
31905098,31905098,PMC7196020,J Orthop Sports Phys Ther,Journal of Orthopaedic & Sports Physical Therapy,2020,"Hip Kinematics During Single-Leg Tasks in People With and Without Hip-Related Groin Pain and the Association Among Kinematics, Hip Muscle Strength, and Bony Morphology.",full_text,1,INCORRECT,Kolmogorov-Smirnov,t-test; Mann-Whitney/Wilcoxon,We used the Kolmogorov-Smirnov test to assess distribution of data and Levene’s test to assess equality of variance.
28158957,28158957,PMC7064314,J Orthop Sports Phys Ther,Journal of Orthopaedic & Sports Physical Therapy,2017,"Trunk Muscle Characteristics of the Multifidi, Erector Spinae, Psoas, and Quadratus Lumborum in Older Adults With and Without Chronic Low Back Pain.",full_text,1,INCORRECT,Shapiro-Wilk,,Model assumptions were tested using the Shapiro-Wilk test for normality and Box’s M and Mauchly’s test for sphericity.
30658048,30658048,PMC7112160,J Orthop Sports Phys Ther,Journal of Orthopaedic & Sports Physical Therapy,2019,The Impact of Decreased Scapulothoracic Upward Rotation on Subacromial Proximities.,full_text,1,INCORRECT,Shapiro-Wilk,t-test; correlation; Mann-Whitney/Wilcoxon,"Data normality was assessed prior to statistical analysis using skewness, kurtosis, and Shapiro-Wilk statistics."
25739842,25739842,PMC4789758,J Orthop Sports Phys Ther,Journal of Orthopaedic & Sports Physical Therapy,2015,The comparative effects of spinal and peripheral thrust manipulation and exercise on pain sensitivity and the relation to clinical outcome: a mechanistic trial using a shoulder pain model.,full_text,2,INCORRECT,Shapiro-Wilk; Kolmogorov-Smirnov,correlation,All continuous data were assessed for normality through observation of plots and with Kolmogorov-Smirnov and Shapiro-Wilk tests.
28992772,28992772,PMC5991486,J Orthop Sports Phys Ther,Journal of Orthopaedic & Sports Physical Therapy,2017,Hip Abductor Muscle Volume and Strength Differences Between Women With Chronic Hip Joint Pain and Asymptomatic Controls.,full_text,1,INCORRECT,Shapiro-Wilk,t-test; Mann-Whitney/Wilcoxon,Intrarater reliability was found to be excellent (TABLE 1).StatisticsThe Shapiro-Wilk test was used to confirm normal distribution of data and Levene’s test was used to confirm equality of variance.
25627155,25627155,PMC4353485,J Orthop Sports Phys Ther,Journal of Orthopaedic & Sports Physical Therapy,2015,Sex-specific gait adaptations prior to and up to 6 months after anterior cruciate ligament reconstruction.,full_text,1,INCORRECT,Kolmogorov-Smirnov,ANOVA,"Histogram plots, Kolmogorov-Smirnov, and Levene's Tests were used to confirm the assumptions of an analysis of variance for the variables of interest."
36103903,36103903,PMC9464470,Arch Phys Med Rehabil,Archives of Physical Medicine and Rehabilitation,2023,"Natural Course of Muscular Strength, Physical Performance, and Musculoskeletal Symptoms in Hospitalized Patients With COVID-19.",full_text,1,INCORRECT,Shapiro-Wilk; Kolmogorov-Smirnov,,"In VAS, 0 indicated no pain at all and 10 represented the strongest pain imaginable.18Abbreviation: VAS, visual analog scale.Data analysisStatistical analyses were made using the IBM SPSS Statistics 20.0 software package (SPSS Inc, Chicago, IL, USA).b The Kolmogorov-Smirnov or Shapiro-Wilk tests wer"
38754720,38754720,PMC11374484,Arch Phys Med Rehabil,Archives of Physical Medicine and Rehabilitation,2024,Moderation Effects of Daily Behavior on Associations Between Symptoms and Social Participation Outcomes After Burn Injury: A 6-Month Digital Phenotyping Study.,full_text_pdf,3,INCORRECT,Shapiro-Wilk,correlation,
39187006,39187006,PMC11620944,Arch Phys Med Rehabil,Archives of Physical Medicine and Rehabilitation,2024,Increased Auditory Dual Task Cost During Gait Initiation in Adult Patients With Persistent Concussion Symptoms.,full_text,2,INCORRECT,Anderson-Darling,ANOVA; Mann-Whitney/Wilcoxon,"(Table 1) All outcome measures were assessed for normality using an Anderson-Darling test and the DTC for APA A/P Displacement and Velocity, APA M/L Velocity were not normally distributed while APA M/L Displacement, resultant COP-COM separation, and Auditory Stroop Test were normally distributed."
37037292,37037292,PMC10524633,Arch Phys Med Rehabil,Archives of Physical Medicine and Rehabilitation,2023,Referent Values for Commonly Used Clinical Mobility Tests in Black and White Adults Aged 50-95 Years.,full_text,1,INCORRECT,Shapiro-Wilk,ANOVA,The normality of the mobility assessment variables was examined using distribution plots and the Shapiro-Wilk test.
37348826,37348826,PMC10730769,Arch Phys Med Rehabil,Archives of Physical Medicine and Rehabilitation,2024,Head Control Contributes to Prediction of Emergence From the Minimally Conscious State in Children Admitted to Inpatient Rehabilitation.,full_text,1,INCORRECT,Kolmogorov-Smirnov,t-test; Mann-Whitney/Wilcoxon,Descriptive statistics were carried out for the sample as a whole and differences were examined between those achieving eMCS vs. not using chi-square/Fisher’s exact tests for categorical variables and t-tests (or Mann-Whitney U if threats to normality were identified using the Kolmogorov-Smirnov tes
34963574,34963574,PMC9064921,Arch Phys Med Rehabil,Archives of Physical Medicine and Rehabilitation,2022,Correlation and Crosswalks Between Patient-Reported Functional Outcomes and PROMIS Physical Function Among Medically Ill Patients.,full_text,2,INCORRECT,Kolmogorov-Smirnov,correlation,"Cumulative score distributions were generated and then the Kolmogorov-Smirnov Two-Sample Test was applied to examine the difference in score distributions.22,23 Additionally, Bland-Altman plots were generated to examine the variation of the score difference between the original and converted PROMIS "
33548208,33548208,PMC7857995,Arch Phys Med Rehabil,Archives of Physical Medicine and Rehabilitation,2021,Do Patients With COVID-19 Benefit from Rehabilitation? Functional Outcomes of the First 100 Patients in a COVID-19 Rehabilitation Unit.,full_text,2,INCORRECT,Shapiro-Wilk,correlation,All statistical analyses were performed according to conditions of normality on Shapiro-Wilk tests.
37149017,37149017,PMC11326884,Arch Phys Med Rehabil,Archives of Physical Medicine and Rehabilitation,2023,Daily Vibrotactile Stimulation Exhibits Equal or Greater Spasticity Relief Than Botulinum Toxin in Stroke.,full_text,1,INCORRECT,Shapiro-Wilk,t-test; Mann-Whitney/Wilcoxon,Wilcoxon Signed-Rank tests were performed for paired comparison on ordinal data (Modified Ashworth and Modified Tardieu Scale ratings) and the AROM data for BTX-A users (since this data was found to be non-normally distributed using a Shapiro-Wilk test).
37329969,37329969,PMC10724372,Arch Phys Med Rehabil,Archives of Physical Medicine and Rehabilitation,2023,Evaluation of Power Wheelchair Dynamic Suspensions for Tip Prevention in Non-ADA Compliant Surfaces.,full_text,1,INCORRECT,Shapiro-Wilk,ANOVA,Normality was evaluated using the Shapiro-Wilk test.
27590444,27590444,PMC5183461,Arch Phys Med Rehabil,Archives of Physical Medicine and Rehabilitation,2017,Multifidi Muscle Characteristics and Physical Function Among Older Adults With and Without Chronic Low Back Pain.,full_text,2,CORRECT,Shapiro-Wilk; Kolmogorov-Smirnov,regression,"Post-hoc, alternate modeling, where BMI was removed from the models, was used to assess the amount of variance shared between BMI and L5 multifidi MFI.Model residuals were evaluated for normality using the Kolmogorov-Smirnov and Shapiro-Wilk tests."
29698638,29698638,PMC6200651,Arch Phys Med Rehabil,Archives of Physical Medicine and Rehabilitation,2018,Energy Impairments in Older Adults With Low Back Pain and Radiculopathy: A Matched Case-Control Study.,full_text,4,MIXED,Shapiro-Wilk; Kolmogorov-Smirnov,ANCOVA/mixed model,Kolmogorov-Smirnov and Shapiro-Wilk tests were used to determine the normality of residuals of ANCOVA models; p-levels ≥ .050 on these tests indicate a violation of the assumption of normality of residuals.
35398048,35398048,PMC9452451,Arch Phys Med Rehabil,Archives of Physical Medicine and Rehabilitation,2022,Use of Standardized Outcome Measures for People With Lower Limb Amputation: A Survey of Prosthetic Practitioners in the United States.,full_text,2,INCORRECT,Shapiro-Wilk,,Numerical data were visually analyzed with quartile-quartile plots and assessed for normality using the Shapiro-Wilk test.
37037293,37037293,PMC10524722,Arch Phys Med Rehabil,Archives of Physical Medicine and Rehabilitation,2023,Using the Instrumented Sway System (ISway) to Identify and Compare Balance Domain Deficits in People With Multiple Sclerosis.,full_text,7,INCORRECT,Shapiro-Wilk,t-test; correlation; Mann-Whitney/Wilcoxon,"Univariate and multivariate distribution of items was determined through skewness and kurtosis values and Mardia’s multivariate test of normality 33,34."
29107041,29107041,PMC5871547,Arch Phys Med Rehabil,Archives of Physical Medicine and Rehabilitation,2018,Lateral Corticospinal Tract Damage Correlates With Motor Output in Incomplete Spinal Cord Injury.,full_text,2,INCORRECT,Kolmogorov-Smirnov,correlation,All data were tested for normality using Kolmogorov-Smirnov (KS) statistical analyses.
36854349,36854349,PMC9968491,Arch Phys Med Rehabil,Archives of Physical Medicine and Rehabilitation,2023,Ultrasound-based Neuropathy Diagnosis in COVID-19 Patients in Post-intensive Care Rehabilitation Settings: A Retrospective Observational Study.,full_text,1,INCORRECT,Kolmogorov-Smirnov,t-test; correlation,"In particular, we analyzed the number of days in ICU and the patient's BMI at their admission in ICU.Statistical analysisData distribution was checked using the Lilliefors test."
33711281,33711281,PMC9310194,Arch Phys Med Rehabil,Archives of Physical Medicine and Rehabilitation,2022,Intra- and Interrater Reliability of Remote Assessment of Transfers by Wheelchair Users Using the Transfer Assessment Instrument (Version 4.0).,full_text,1,INCORRECT,Shapiro-Wilk,t-test; correlation,"Data were normally distributed based on the Shapiro-Wilk test so pairwise t-tests with a Holm correction for multiple comparisons were used to determine if differences existed for transfer 1 in TAI scores between the remote rater and the average score of in-person raters, as well as between transfer"
34090853,34090853,PMC8645659,Arch Phys Med Rehabil,Archives of Physical Medicine and Rehabilitation,2022,Efficacy of a Remote Train-the-Trainer Model for Wheelchair Skills Training Administered by Clinicians: A Cohort Study With Pre- vs Posttraining Comparisons.,full_text,1,INCORRECT,Shapiro-Wilk,,Normality was assessed using the Shapiro-Wilk test.
34090854,34090854,PMC8642492,Arch Phys Med Rehabil,Archives of Physical Medicine and Rehabilitation,2022,Effectiveness of a Web-Based Direct-to-User Transfer Training Program: A Randomized Controlled Trial.,full_text,1,INCORRECT,Shapiro-Wilk,t-test,TAI-Q scores were normally distributed as evaluated by the Shapiro-Wilk test.
32113974,32113974,PMC7311247,Arch Phys Med Rehabil,Archives of Physical Medicine and Rehabilitation,2020,Survivors of Chronic Stroke Experience Continued Impairment of Dexterity But Not Strength in the Nonparetic Upper Limb.,full_text,1,INCORRECT,Kolmogorov-Smirnov,t-test,Normal probability plots and the Kolmogorov-Smirnov tests were used to evaluate the normal distributions of the Z-scores.
33711279,33711279,PMC7943375,Arch Phys Med Rehabil,Archives of Physical Medicine and Rehabilitation,2021,Persistent Symptoms and Disability After COVID-19 Hospitalization: Data From a Comprehensive Telerehabilitation Program.,full_text,1,INCORRECT,Shapiro-Wilk,Mann-Whitney/Wilcoxon,Shapiro-Wilk test showed that all continuous variables did not present normal distribution.
28950984,28950984,,Arch Phys Med Rehabil,Archives of Physical Medicine and Rehabilitation,2017,Importance of the Correct Use of Extracorporeal Shockwave Therapy.,none,0,UNCLEAR,,,
31778661,31778661,PMC7050431,Arch Phys Med Rehabil,Archives of Physical Medicine and Rehabilitation,2020,Predictors of Walking Activity in Children and Adolescents With Myelomeningocele.,full_text,1,CORRECT,Shapiro-Wilk,regression,"The assumption of normality of the residuals was verified for the final model through visual inspection of the residual distribution, standardized normal probability and quantile plots, and using the Shapiro-Wilk W test.In a secondary post-hoc analysis, logistic regression was used to assess which v"
